Pub_year,Title,DOI,subject,top5_keywords
1962.0,host specificity of dna produced by escherichia coli ii control over acceptance of dna from infecting phage ,https://doi.org/10.1016/S0022-2836(62)80059-X,Medicine,dna acceptance infecting phage host escherichia control specificity coli ii
1970.0,a restriction enzyme from hemophilus influenzae i purification and general properties,https://doi.org/10.1016/0022-2836(70)90149-X,Medicine,hemophilus influenzae restriction purification enzyme general properties
1969.0,discovery of modification of the synthetic tripeptide sequence of the thyrotropin releasing hormone having activity,https://doi.org/10.1016/0006-291X(69)90889-4,Medicine,tripeptide releasing thyrotropin modification hormone discovery synthetic sequence activity
1969.0,the identity of chemical and hormonal properties of the thyrotropin releasing hormone and pyroglutamyl histidyl proline amide,https://doi.org/10.1016/0006-291X(69)90868-7,Medicine,pyroglutamyl identity histidyl proline releasing thyrotropin hormonal amide hormone chemical
1969.0,isolation and properties of porcine thyrotropin releasing hormone,,Medicine,porcine releasing thyrotropin hormone isolation properties
1959.0,quantitative aspects of the reaction between insulin and insulin binding antibody,https://doi.org/10.1172/JCI103979,Medicine,insulin aspects quantitative antibody binding reaction
1956.0,insulin i131 metabolism in human subjects demonstration of insulin binding globulin in the circulation of insulin treated subjects,https://doi.org/10.1172/JCI103262,Medicine,insulin subjects i131 demonstration circulation metabolism globulin treated human binding
1960.0,immunoassay of endogenous plasma insulin in man,https://doi.org/10.1172/JCI104130,Medicine,immunoassay man insulin endogenous plasma
1966.0,experimental transmission of a kuru like syndrome to chimpanzees,https://doi.org/10.1038/209794a0,Medicine,chimpanzees kuru syndrome transmission like experimental
1955.0,tissue fractionation studies 6 intracellular distribution patterns of enzymes in rat liver tissue,https://doi.org/10.1042/bj0600604,Medicine,tissue fractionation patterns enzymes intracellular rat liver distribution studies
1955.0,tissue fractionation studies 5 the association of acid phosphatase with a special class of cytoplasmic granules in rat liver,https://doi.org/10.1042/bj0590438,Medicine,class association phosphatase granules fractionation cytoplasmic special rat tissue liver
1955.0,tissue fractionation studies 4 comparative study of the binding of acid phosphatase  glucuronidase and cathepsin by rat liver particles,https://doi.org/10.1042/bj0590433,Medicine,cathepsin glucuronidase comparative phosphatase fractionation rat study tissue liver binding
1946.0,the distribution of cytochrome oxidase and succinoxidase in the cytoplasm of the mammalian liver cell,,Medicine,succinoxidase oxidase cytochrome cytoplasm mammalian liver distribution cell
1927.0,Aus dem Leben der Bienen,https://doi.org/10.1007/978-3-642-64923-3,Medicine,bienen leben dem aus der
1935.0,Der Kumpan in der Umwelt des Vogels,https://doi.org/10.1007/BF01905355,Medicine,der vogels umwelt kumpan des
1937.0,The Companion in the Bird's World,https://doi.org/10.2307/4078077,Medicine,bird world companion
1937.0,ber die Bildung des Instinktbegriffes,https://doi.org/10.1007/BF01491749,Medicine,instinktbegriffes bildung ber die des
1959.0,dissociation of  globulin,https://doi.org/10.1021/ja01521a071,Medicine,dissociation globulin
1959.0,the hydrolysis of rabbit  globulin and antibodies with crystalline papain,https://doi.org/10.1042/bj0730119,Medicine,papain hydrolysis globulin crystalline rabbit antibodies
1962.0,adenyl cyclase iii the effect of catecholamines and choline esters on the formation of adenosine 3 5 phosphate by preparations from cardiac muscle and liver,,Medicine,choline catecholamines cardiac esters preparations phosphate adenosine muscle iii adenyl
1962.0,adenyl cyclase iv the effects of neurohormones on the formation of adenosine 3 5 phosphate by preparations from brain and other tissues,,Medicine,neurohormones iv brain preparations phosphate adenosine adenyl tissues cyclase formation
1962.0,adenyl cyclase i distribution preparation and properties,,Medicine,preparation adenyl cyclase distribution properties
1962.0,adenosine 3 5 phosphate in biological materials i purification and properties of cyclic 3 5 nucleotide phosphodiesterase and use of this enzyme to characterize adenosine 3 5 phosphate in human urine,,Medicine,phosphate adenosine characterize urine phosphodiesterase cyclic materials purification nucleotide biological
1957.0,o methylation of epinephrine and other catechols in vitro and in vivo,https://doi.org/10.1126/science.126.3270.400,Medicine,catechols epinephrine methylation vivo vitro
1958.0,enzymatic o methylation of epinephrine and other catechols,,Medicine,catechols epinephrine methylation enzymatic
1949.0,the effect of sodium ions on the electrical activity of the giant axon of the squid,https://doi.org/10.1113/jphysiol.1949.sp004310,Medicine,squid axon giant electrical sodium ions effect activity
1954.0,quantal components of the end plate potential,https://doi.org/10.1113/jphysiol.1954.sp005129,Medicine,quantal plate end components potential
1957.0,a study of the desensitization produced by acetylcholine at the motor end plate,https://doi.org/10.1113/jphysiol.1957.sp005838,Medicine,desensitization acetylcholine motor plate end study produced
1951.0,an analysis of the end plate potential recorded with an intra cellular electrode,https://doi.org/10.1113/jphysiol.1951.sp004675,Medicine,intra electrode cellular plate recorded end potential analysis
1952.0,spontaneous subthreshold activity at motor nerve endings,https://doi.org/10.1113/jphysiol.1952.sp004735,Medicine,endings subthreshold spontaneous motor nerve activity
1943.0,MUTATIONS OF BACTERIA FROM VIRUS SENSITIVITY TO VIRUS RESISTANCE,,Medicine,virus resistance bacteria mutations sensitivity
1943.0,MUTATIONS OF BACTERIA FROM VIRUS SENSITIVITY TO VIRUS RESISTANCE,,Medicine,virus resistance bacteria mutations sensitivity
1961.0,the dependence of cell free protein synthesis in e coli upon naturally occuring or synthetic polyribonucleotides,,Medicine,polyribonucleotides occuring naturally dependence synthetic coli upon free synthesis cell
1961.0,nucleoside polyphosphates x 1 the synthesis and some reactions of nucleoside 5 phosphoromorpholidates and related compounds improved methods for the preparation of nucleoside 5 polyphosphates1,https://doi.org/10.1021/ja01464a034,Medicine,nucleoside phosphoromorpholidates polyphosphates1 polyphosphates improved preparation related methods compounds reactions
1958.0,carbodiimides viii 1 observations on the reactions of carbodiimides with acids and some new applications in the synthesis of phosphoric acid esters,https://doi.org/10.1021/ja01556a015,Medicine,carbodiimides phosphoric esters applications viii observations acids acid reactions synthesis
1962.0,studies on polynucleotides xiv 1specific synthesis of the c3 c5 interribonucleotide linkage syntheses of uridylyl 3 5 uridine and uridylyl 3 5 adenosine2,https://doi.org/10.1021/ja00862a023,Medicine,uridylyl adenosine2 uridine interribonucleotide c5 1specific c3 xiv polynucleotides syntheses
1963.0,studies on polynucleotides xxiv 1 the stepwise synthesis of specific deoxyribopolynucleotides 4 2 protected derivatives of deoxyribonucleosides and new syntheses of deoxyribonucleoside 3 phosphates3,https://doi.org/10.1021/ja00906a021,Medicine,phosphates3 deoxyribonucleoside deoxyribonucleosides protected deoxyribopolynucleotides stepwise xxiv polynucleotides syntheses derivatives
1959.0,studies on polynucleotides iii enzymic degradation substrate specificity and properties of snake venom phosphodiesterase,,Medicine,venom snake enzymic phosphodiesterase polynucleotides degradation iii substrate specificity studies
1953.0,supraspinal control of the muscle spindles and its significance,https://doi.org/10.1113/jphysiol.1953.sp005017,Medicine,spindles supraspinal significance muscle control
1956.0,excitatory and inhibitory processes acting upon individual purkinje cells of the cerebellum in cats,https://doi.org/10.1113/jphysiol.1956.sp005606,Medicine,cats cerebellum purkinje inhibitory excitatory acting processes upon individual cells
1944.0,fibre interaction in injured or compressed region of nerve,https://doi.org/10.1093/brain/67.2.125,Medicine,compressed injured fibre region interaction nerve
1933.0,the components of the retinal action potential in mammals and their relation to the discharge in the optic nerve,https://doi.org/10.1113/jphysiol.1933.sp002964,Medicine,retinal optic mammals discharge relation components nerve potential action
1952.0,the peripheral origin of nervous activity in the visual system,https://doi.org/10.1101/SQB.1952.017.01.013,Medicine,nervous peripheral origin visual activity system
1952.0,cistrans isomers of vitamin a and retinene in vision,https://doi.org/10.1126/science.115.2977.60,Medicine,cistrans retinene isomers vision vitamin
1963.0,pre lumirhodopsin and the bleaching of visual pigments,https://doi.org/10.1038/1971279a0,Medicine,lumirhodopsin pre bleaching pigments visual
1941.0,studies on prostatic cancer i the effect of castration of estrogen and of androgen injection on serum phosphatases in metastatic carcinoma of the prostate,,Medicine,prostate carcinoma metastatic phosphatases androgen castration estrogen prostatic cancer injection
1911.0,a sarcoma of the fowl transmissible by an agent separable from the tumor cells,https://doi.org/10.1084/jem.13.4.397,Medicine,transmissible fowl separable sarcoma tumor agent cells
1961.0,genetic regulatory mechanisms in the synthesis of proteins,https://doi.org/10.1016/S0022-2836(61)80072-7,Medicine,mechanisms regulatory genetic proteins synthesis
1950.0,induction of bacteriophage production in a bacterium,,Medicine,bacterium bacteriophage induction production
1961.0,on the regulation of gene activity,https://doi.org/10.1101/SQB.1961.026.01.024,Medicine,regulation gene activity
1961.0,genetic regulatory mechanisms in the synthesis of proteins,https://doi.org/10.1016/S0022-2836(61)80072-7,Medicine,mechanisms regulatory genetic proteins synthesis
1963.0,allosteric proteins and cellular control systems,https://doi.org/10.1016/S0022-2836(63)80091-1,Medicine,allosteric cellular control systems proteins
1961.0,general conclusions teleonomic mechanisms in cellular metabolism growth and differentiation,https://doi.org/10.1101/SQB.1961.026.01.048,Medicine,teleonomic conclusions differentiation metabolism cellular mechanisms growth general
1943.0,the biological conversion of cholesterol to cholic acid,,Medicine,cholic cholesterol conversion biological acid
1952.0,the recording of potentials from motoneurones with an intracellular electrode,https://doi.org/10.1113/jphysiol.1952.sp004759,Medicine,motoneurones electrode potentials recording intracellular
1954.0,cholinergic and inhibitory synapses in a pathway from motor axon collaterals to motoneurones,https://doi.org/10.1113/jphysiol.1954.sp005226,Medicine,collaterals cholinergic synapses motoneurones axon inhibitory motor pathway
1953.0,molecular structure of deoxypentose nucleic acids,https://doi.org/10.1007/978-3-662-47150-0_6,Medicine,deoxypentose nucleic acids molecular structure
1953.0,the structure of dna,https://doi.org/10.1101/SQB.1953.018.01.020,Medicine,dna structure
1953.0,genetical implications of the structure of deoxyribonucleic acid,https://doi.org/10.1038/171964b0,Medicine,genetical deoxyribonucleic implications acid structure
1953.0,the packing of  helices simple coiled coils,https://doi.org/10.1107/S0365110X53001964,Medicine,coils coiled packing helices simple
1953.0,genetical implications of the structure of deoxyribonucleic acid,https://doi.org/10.1038/171964b0,Medicine,genetical deoxyribonucleic implications acid structure
1947.0,a new audiometer,https://doi.org/10.3109/00016484709123756,Medicine,audiometer new
1951.0,the technique of free skin grafting in mammals,,Medicine,skin grafting mammals technique free
1950.0,the failure of antibody production in the chick embryo,https://doi.org/10.1038/icb.1950.29,Medicine,chick failure embryo antibody production
1958.0,enzymatic synthesis of deoxyribonucleic acid i preparation of substrates and partial purification of an enzyme from escherichia coli,,Medicine,deoxyribonucleic substrates partial preparation enzymatic purification escherichia coli enzyme acid
1955.0,116 isocitric dehydrogenase system tpn from pig heart,https://doi.org/10.1016/0076-6879(55)01121-X,Medicine,tpn dehydrogenase isocitric 116 heart pig system
1955.0,124 malic enzyme,https://doi.org/10.1016/0076-6879(55)01129-4,Medicine,malic 124 enzyme
1937.0,protective effect of phenolic ethers in the course of histaminic intoxication.,,Medicine,intoxication histaminic phenolic protective ethers course effect
1948.0,comparison of the fick and dye injection methods of measuring the cardiac output in man,https://doi.org/10.1152/ajplegacy.1948.153.2.309,Medicine,fick cardiac dye output man measuring comparison injection methods
1948.0,pulmonary in sufficiency i physiological classification clinical methods of analysis standard values in normal subjects,https://doi.org/10.1097/00005792-194809000-00001,Medicine,classification sufficiency clinical pulmonary standard values physiological subjects methods normal
1948.0,pulmonary in sufficiency i physiological classification clinical methods of analysis standard values in normal subjects,https://doi.org/10.1097/00005792-194809000-00001,Medicine,classification sufficiency clinical pulmonary standard values physiological subjects methods normal
1948.0,comparison of the fick and dye injection methods of measuring the cardiac output in man,https://doi.org/10.1152/ajplegacy.1948.153.2.309,Medicine,fick cardiac dye output man measuring comparison injection methods
1935.0,the yellow oxidation-enzyme,,Medicine,yellow oxidation enzyme
1949.0,cultivation of the lansing strain of poliomyelitis virus in cultures of various human embryonic tissues,https://doi.org/10.1126/science.109.2822.85,Medicine,lansing cultivation poliomyelitis strain embryonic tissues cultures various human virus
1949.0,cultivation of the lansing strain of poliomyelitis virus in cultures of various human embryonic tissues,https://doi.org/10.1126/science.109.2822.85,Medicine,lansing cultivation poliomyelitis strain embryonic tissues cultures various human virus
1949.0,cultivation of the lansing strain of poliomyelitis virus in cultures of various human embryonic tissues,https://doi.org/10.1126/science.109.2822.85,Medicine,lansing cultivation poliomyelitis strain embryonic tissues cultures various human virus
1945.0,a specific micromethod for the determination of acyl phosphates,,Medicine,phosphates micromethod acyl determination specific
1937.0,metabolism of ketonic acids in animal tissues,https://doi.org/10.1042/bj0310645,Medicine,ketonic metabolism animal tissues acids
1940.0,the soil as a source of microorganisms antagonistic to disease producing bacteria,,Medicine,antagonistic microorganisms soil source bacteria disease producing
1937.0,atrophy of the adrenal cortex of the rat produced by the administration of large amounts of cortin,https://doi.org/10.1126/science.86.2228.245,Medicine,cortin administration atrophy adrenal amounts rat cortex large produced
1936.0,the chemistry of crystalline substances isolated from the suprarenal gland,,Medicine,gland suprarenal chemistry crystalline substances isolated
1937.0,desoxy cortico steron 21 oxy progesteron aus 5 3 oxy atio cholensaure,https://doi.org/10.1002/hlca.193702001158,Medicine,oxy cholensaure atio progesteron steron desoxy cortico 21 aus
1934.0,eine ergiebige synthese der l ascorbinsaure c vitamin,https://doi.org/10.1002/hlca.19340170136,Medicine,ascorbinsaure ergiebige synthese eine vitamin der
1949.0,the effect of a hormone of the adrenal cortex (17-hydroxy-11-dehydrocorticosterone - compound-e) and of pituitary adrenocorticotropic hormone on rheumatoid arthritis - preliminary report,https://doi.org/10.1136/ard.8.2.97,Medicine,hormone rheumatoid arthritis dehydrocorticosterone pituitary adrenocorticotropic 17 adrenal compound hydroxy
1936.0,hypothalamus und die zentren des autonomen nervensystems physiologie,https://doi.org/10.1007/BF01814243,Medicine,physiologie nervensystems autonomen zentren hypothalamus die und des
1944.0,the constitution and toxic effect of natural and new synthetic insect killing substances,,Medicine,killing insect toxic natural constitution synthetic substances effect new
1929.0,glycogen formation in the liver from d and l lactic acid,,Medicine,lactic glycogen liver formation acid
1929.0,glycogen formation in the liver from d and l lactic acid,,Medicine,lactic glycogen liver formation acid
1928.0,the production of mutations by x rays,https://doi.org/10.1073/pnas.14.9.714,Medicine,mutations production rays
1928.0,the measurement of gene mutation rate in drosophila its high variability and its dependence upon temperature,,Medicine,variability dependence mutation measurement drosophila rate upon temperature gene
1941.0,further observations on penicillin,https://doi.org/10.1016/S0140-6736(00)72122-2,Medicine,penicillin observations
1940.0,penicillin as a chemotherapeutic agent,https://doi.org/10.1016/S0140-6736(01)08728-1,Medicine,chemotherapeutic penicillin agent
1929.0,on the antibacterial action of cultures of a penicillium with special reference to their use in the isolation of b influenzae,,Medicine,penicillium antibacterial reference influenzae special isolation cultures action
1940.0,penicillin as a chemotherapeutic agent,https://doi.org/10.1016/S0140-6736(01)08728-1,Medicine,chemotherapeutic penicillin agent
1925.0,the nature of conduction of an impulse in the relatively refractory period,https://doi.org/10.1152/ajplegacy.1925.73.3.613,Medicine,refractory impulse relatively conduction period nature
1929.0,the role of fiber size in the establishment of a nerve block by pressure or cocaine,https://doi.org/10.1152/ajplegacy.1929.88.4.581,Medicine,cocaine establishment fiber block size role pressure nerve
1924.0,the compound nature of the action current of nerve as disclosed by the cathode ray oscillograph,https://doi.org/10.1152/ajplegacy.1924.70.3.624,Medicine,oscillograph disclosed compound cathode nature current nerve ray action
1922.0,a study of the action currents of nerve with the cathode ray oscillograph,https://doi.org/10.1152/ajplegacy.1922.62.3.496,Medicine,oscillograph currents cathode study nerve ray action
1927.0,the role played by the sizes of the constituent fibers of a nerve trunk in determining the form of its action potential wave,https://doi.org/10.1152/ajplegacy.1927.80.3.522,Medicine,trunk fibers constituent sizes played determining wave role nerve potential
1925.0,the nature of conduction of an impulse in the relatively refractory period,https://doi.org/10.1152/ajplegacy.1925.73.3.613,Medicine,refractory impulse relatively conduction period nature
1929.0,the role of fiber size in the establishment of a nerve block by pressure or cocaine,https://doi.org/10.1152/ajplegacy.1929.88.4.581,Medicine,cocaine establishment fiber block size role pressure nerve
1924.0,the compound nature of the action current of nerve as disclosed by the cathode ray oscillograph,https://doi.org/10.1152/ajplegacy.1924.70.3.624,Medicine,oscillograph disclosed compound cathode nature current nerve ray action
1922.0,a study of the action currents of nerve with the cathode ray oscillograph,https://doi.org/10.1152/ajplegacy.1922.62.3.496,Medicine,oscillograph currents cathode study nerve ray action
1927.0,the role played by the sizes of the constituent fibers of a nerve trunk in determining the form of its action potential wave,https://doi.org/10.1152/ajplegacy.1927.80.3.522,Medicine,trunk fibers constituent sizes played determining wave role nerve potential
1939.0,the isolation of vitamins k1 and,https://doi.org/10.1021/ja01874a507,Medicine,k1 vitamins isolation
1939.0,the isolation of vitamin k2,,Medicine,k2 vitamin isolation
1935.0,the antihaemorrhagic vitamin of the chick,https://doi.org/10.1042/bj0291273,Medicine,antihaemorrhagic chick vitamin
1935.0,eine neue klasse von desinfektionsmitteln,https://doi.org/10.1055/s-0028-1129654,Medicine,desinfektionsmitteln klasse neue eine von
1935.0,ein beitrag zur chemotherapie der bakteriellen infektionen,https://doi.org/10.1055/s-0028-1129486,Medicine,infektionen bakteriellen chemotherapie beitrag ein zur der
1931.0,"the mechanism of bradycardia caused by nicotine, lobeline, cyanine, sodium sulphur, nitrite and morphine. the asphyctic bradycardia",,Medicine,bradycardia morphine asphyctic nitrite cyanine nicotine lobeline sulphur caused sodium
1914.0,the action of certain esters and ethers of choline and their relation to muscarine,,Medicine,muscarine choline ethers esters relation certain action
1924.0,uber humorale ubertragbarkeit der herznervenwirkung,https://doi.org/10.1007/BF01722757,Medicine,herznervenwirkung ubertragbarkeit humorale uber der
1924.0,uber induktion von embryonalanlagen durch implantation artfremder organisatoren,https://doi.org/10.1007/BF02108176,Medicine,organisatoren artfremder induktion embryonalanlagen implantation durch von uber
1920.0,blood volume studies iii behavior of large series of dyes introduced into the circulating blood,https://doi.org/10.1152/ajplegacy.1920.51.2.232,Medicine,blood dyes circulating volume introduced iii series behavior large studies
1916.0,sex limited inheritance in drosophila,https://doi.org/10.1126/science.32.812.120,Medicine,inheritance sex limited drosophila
1929.0,the discharge of impulses in motor nerve fibres part ii the frequency of discharge in reflex and voluntary contractions,https://doi.org/10.1113/jphysiol.1929.sp002557,Medicine,discharge voluntary contractions fibres impulses reflex motor frequency nerve ii
1928.0,the discharge of impulses in motor nerve fibres part i impulses in single fibres of the phrenic nerve,https://doi.org/10.1113/jphysiol.1928.sp002509,Medicine,fibres impulses nerve phrenic discharge motor part single
1912.0,feeding experiments illustrating the importance of accessory factors in normal dietaries,https://doi.org/10.1113/jphysiol.1912.sp001524,Medicine,dietaries accessory illustrating feeding importance factors normal experiments
1909.0,experimental reproduction of exanthematic typhus in the monkey,,Medicine,reproduction exanthematic typhus monkey experimental
1909.0,experiemntal transmission of the exanthematic typhus by the body louse.,,Medicine,louse experiemntal typhus exanthematic body transmission
1903.0,ein neues galvanometer,https://doi.org/10.1002/andp.19033171308,Medicine,galvanometer neues ein
1921.0,The internal secretion of the pancreas,https://doi.org/10.5555/uri:pii:S0022214322903841,Medicine,pancreas secretion internal
1922.0,the internal secretion of the pancreas,https://doi.org/10.5555/uri:pii:S0022214322903841,Medicine,pancreas secretion internal
1922.0,pancreatic extracts in the treatment of diabetes mellitus,,Medicine,mellitus diabetes pancreatic extracts treatment
1919.0,uber die atmung der froschmuskulatur,https://doi.org/10.1007/BF01722140,Medicine,froschmuskulatur atmung die uber der
1910.0,a new mathematical treatment of changes of ionic concentration in muscle and nerve under the action of electric currents with a theory as to their mode of excitation,https://doi.org/10.1113/jphysiol.1910.sp001366,Medicine,ionic mathematical mode currents excitation muscle concentration electric changes treatment
1913.0,the combinations of haemoglobin with oxygen and with carbon monoxide i,https://doi.org/10.1042/bj0070471,Medicine,monoxide haemoglobin combinations oxygen carbon
1919.0,the rate of diffusion of gases through animal tissues with some remarks on the coefficient of invasion,https://doi.org/10.1113/jphysiol.1919.sp001838,Medicine,invasion remarks coefficient gases animal diffusion tissues rate
1913.0,the regulation of respiration and circulation during the initial stages of muscular work,https://doi.org/10.1113/jphysiol.1913.sp001616,Medicine,muscular stages respiration circulation initial regulation work
1919.0,the supply of oxygen to the tissues and the regulation of the capillary circulation,https://doi.org/10.1113/jphysiol.1919.sp001844,Medicine,capillary supply circulation regulation oxygen tissues
1919.0,the number and distribution of capillaries in muscles with calculations of the oxygen pressure head necessary for supplying the tissue,https://doi.org/10.1113/jphysiol.1919.sp001839,Medicine,supplying capillaries head muscles calculations oxygen necessary tissue pressure distribution
1902.0,the anaphylactic effect of certain venoms,,Medicine,venoms anaphylactic certain effect
1902.0,the anaphylactic effects of the actinotoxin on the arterial pressure,,Medicine,actinotoxin arterial anaphylactic pressure effects
1902.0,the physiological effects of the poison of fisher strands and tentacles of coelenterata (hypnotoxin),,Medicine,hypnotoxin coelenterata tentacles fisher poison strands physiological effects
1906.0,results of the biterminal transplantation of veins,https://doi.org/10.1097/00000441-190609000-00006,Medicine,veins biterminal transplantation results
1910.0,viii on the experimental surgery of the thoracic aorta and heart,https://doi.org/10.1097/00000658-191007000-00009,Medicine,thoracic surgery heart aorta viii experimental
1907.0,the surgery of blood vessels etc,,Medicine,etc surgery vessels blood
1973.0,ordering metastability and phase transitions in two dimensional systems,https://doi.org/10.1088/0022-3719/6/7/010,Physics,transition order type model discussed phase displays definition singularities superconductor
