Pub_year,Title,DOI,subject,top5_keywords
1945.0,studies on phosphorylation .1. dibenzyl chlorophosphonate as a phosphorylating agent,https://doi.org/10.1039/JR9450000382,Chemistry,phosphorylating chlorophosphonate dibenzyl phosphorylation agent studies
1938.0,333 the activation energy of organic reactions part iv transmission of substituent influences in ester hydrolysis,https://doi.org/10.1039/JR9380001801,Chemistry,ester influences 333 substituent iv hydrolysis activation transmission organic part
1934.0,227 on the factors determining the velocity of reactions in solution molecular statistics of the benzoylation of amines,https://doi.org/10.1039/JR9340001079,Chemistry,benzoylation 227 statistics amines factors determining velocity solution molecular reactions
1935.0,Chemical kinetics and chain reactions,,Chemistry,kinetics chain chemical reactions
1953.0,the synthesis of an octapeptide amide with the hormonal activity of oxytocin,https://doi.org/10.1021/ja01115a553,Chemistry,oxytocin octapeptide amide hormonal activity synthesis
1954.0,the synthesis of oxytocin1,https://doi.org/10.1021/ja01641a004,Chemistry,oxytocin1 synthesis
1921.0,uber neue organische phosphorverbindungen iv phosphinimine,https://doi.org/10.1002/hlca.19210040192,Chemistry,phosphinimine phosphorverbindungen organische neue iv uber
1920.0,einwirkungen von aliphatischen diazoverbindungen auf thioketone,https://doi.org/10.1002/hlca.19200030178,Chemistry,thioketone diazoverbindungen aliphatischen einwirkungen auf von
1919.0,uber neue organische phosphorverbindungen iii phosphinmethylenderivate und phosphinimine,https://doi.org/10.1002/hlca.19190020164,Chemistry,phosphinmethylenderivate phosphinimine phosphorverbindungen organische neue iii und uber
1941.0,a new form of chromatogram employing two liquid phases a theory of chromatography 2 application to the micro determination of the higher monoamino acids in proteins,https://doi.org/10.1016/0968-0004(77)90204-3,Chemistry,monoamino chromatogram micro employing phases chromatography application determination higher liquid
1941.0,a new form of chromatogram employing two liquid phases a theory of chromatography 2 application to the micro determination of the higher monoamino acids in proteins,https://doi.org/10.1016/0968-0004(77)90204-3,Chemistry,monoamino chromatogram micro employing phases chromatography application determination higher liquid
1946.0,radioactive element 94 from deuterons on uranium,https://doi.org/10.1103/PhysRev.69.366.2,Chemistry,deuterons uranium 94 radioactive element
1940.0,radioactive element 93,https://doi.org/10.1103/PhysRev.57.1185.2,Chemistry,93 radioactive element
1928.0,synthesen in der hydroaromatischen reihe,https://doi.org/10.1002/jlac.19284600106,Chemistry,reihe hydroaromatischen synthesen der
1928.0,synthesen in der hydroaromatischen reihe,https://doi.org/10.1002/jlac.19284600106,Chemistry,reihe hydroaromatischen synthesen der
1933.0,attainment of temperatures below 1 absolute by demagnetization ofgd2 so4 3 8h2o,https://doi.org/10.1103/PhysRev.43.768,Chemistry,8h2o so4 ofgd2 demagnetization attainment absolute temperatures
1937.0,a new apparatus for electrophoretic analysis of colloidal mixtures,https://doi.org/10.1039/TF9373300524,Chemistry,colloidal mixtures electrophoretic apparatus analysis new
1937.0,electrophoresis of serum globulin electrophoretic analysis of normal and immune sera,https://doi.org/10.1042/bj0311464,Chemistry,sera globulin electrophoretic immune electrophoresis serum normal analysis
1917.0,lxxv a theory of the mechanism of the phytochemical synthesis of certain alkaloids,https://doi.org/10.1039/CT9171100876,Chemistry,alkaloids phytochemical lxxv certain mechanism synthesis
1936.0,the inactivation of crystalline tobacco mosaic virus protein,https://doi.org/10.1126/science.83.2165.626,Chemistry,mosaic tobacco inactivation crystalline virus protein
1936.0,chemical studies on the virus of tobacco mosaic vi the isolation from diseased turkish tobacco plants of a crystalline protein possessing the properties of tobacco mosaic virus,,Chemistry,tobacco mosaic virus vi possessing turkish diseased plants crystalline isolation
1926.0,the isolation and crystallization of the enzyme urease preliminary paper,,Chemistry,urease crystallization preliminary isolation enzyme paper
1932.0,the enzymatic fission and synthesis of asparaginic acid.,,Chemistry,asparaginic fission enzymatic acid synthesis
1939.0,uber den nachweis und das verhalten der bei der bestrahlung des urans mittels neutronen entstehenden erdalkalimetalle,https://doi.org/10.1007/BF01488241,Chemistry,der entstehenden erdalkalimetalle mittels urans bestrahlung neutronen verhalten nachweis bei
1923.0,the absorption and translocation of lead by plants a contribution to the application of the method of radioactive indicators in the investigation of the change of substance in plants,https://doi.org/10.1042/bj0170439,Chemistry,plants translocation indicators contribution investigation radioactive application absorption lead change
1923.0,hohere terpenverbindungen ix uber die totalsynthese des d l nerolidols und des farnesols,https://doi.org/10.1002/hlca.19230060151,Chemistry,des farnesols nerolidols totalsynthese terpenverbindungen ix hohere die und uber
1923.0,hohere terpenverbindungen viii uber die konstitution des nerolidols peruviol,https://doi.org/10.1002/hlca.19230060150,Chemistry,peruviol nerolidols konstitution terpenverbindungen hohere viii die uber des
1925.0,hohere terpenverbindungen xxiv ringbildungen bei sesquiterpenen totalsynthese des bisabolens und eines hexahydro cadalins,https://doi.org/10.1002/hlca.19250080144,Chemistry,cadalins hexahydro bisabolens sesquiterpenen ringbildungen eines xxiv totalsynthese terpenverbindungen hohere
1935.0,uber androstendion einen hochwirksamen mannlichen pragungsstoff ein beitrag zur genese der keimdrusenhormone,https://doi.org/10.1515/bchm2.1935.237.1-3.75,Chemistry,keimdrusenhormone genese pragungsstoff mannlichen hochwirksamen androstendion einen beitrag ein zur
1934.0,zur isolierung und charakterisierung des corpus luteum hormons,https://doi.org/10.1002/cber.19340670831,Chemistry,hormons charakterisierung luteum corpus isolierung zur und des
1935.0,notiz uber ein isomeres allo pregnanol 3 on 20,https://doi.org/10.1002/cber.19350680934,Chemistry,pregnanol allo isomeres notiz 20 ein uber
1934.0,uber androsteron iii isolierung eines neuen physiologisch unwirksamen sterinderivates aus mannerharn seine verknupfung mit dehydro androsteron und androsteron ein beitrag zur konstitution des androsterons,https://doi.org/10.1515/bchm2.1934.229.4-6.192,Chemistry,androsteron seine mannerharn physiologisch sterinderivates verknupfung unwirksamen eines androsterons dehydro
1935.0,uber testosteron umwandlung des dehydro androsterons in androstendiol und testosteron ein weg zur darstellung des testosterons aus cholesterin,https://doi.org/10.1515/bchm2.1935.237.1-3.89,Chemistry,testosteron des testosterons androstendiol weg umwandlung cholesterin darstellung androsterons dehydro
1934.0,uberfuhrung des pregnandiols in corpus luteum hormon,https://doi.org/10.1002/cber.19340671126,Chemistry,hormon pregnandiols uberfuhrung luteum corpus des
1933.0,mikro bestimmung von acetyl benzoyl und c methylgruppen,https://doi.org/10.1002/cber.19330660922,Chemistry,methylgruppen benzoyl bestimmung acetyl mikro von und
1928.0,the structure of carbohydrates,https://doi.org/10.1002/hlca.19280110166,Chemistry,carbohydrates structure
1928.0,lxxxiii polysaccharides part i the structure of inulin,https://doi.org/10.1039/JR9280000619,Chemistry,inulin polysaccharides lxxxiii part structure
1931.0,zur kenntnis des vitamins a aus fischtranen,https://doi.org/10.1002/hlca.19310140511,Chemistry,fischtranen vitamins kenntnis aus zur des
1912.0,zur theorie der spezifischen warmen,https://doi.org/10.1002/andp.19123441404,Chemistry,warmen spezifischen theorie zur der
1934.0,artificial production of a new kind of radio element,https://doi.org/10.1038/133201a0,Chemistry,radio artificial kind element production new
1932.0,a hydrogen isotope of mass 2,https://doi.org/10.1103/PhysRev.39.164,Chemistry,isotope hydrogen mass
1918.0,the adsorption of gases on plane surfaces of glass mica and platinum,https://doi.org/10.1021/ja02242a004,Chemistry,glass mica platinum plane gases surfaces adsorption
1917.0,the constitution and fundamental properties of solids and liquids ii liquids 1,https://doi.org/10.1021/ja02254a006,Chemistry,liquids fundamental solids constitution ii properties
1917.0,the constitution and fundamental properties of solids and liquids,https://doi.org/10.1016/S0016-0032(17)90938-X,Chemistry,fundamental solids constitution liquids properties
1917.0,the constitution and fundamental properties of solids and liquids part ii liquids,https://doi.org/10.1016/S0016-0032(17)90088-2,Chemistry,liquids fundamental solids constitution ii part properties
1913.0,formation of anthracite,,Chemistry,anthracite formation
1913.0,ABSORBING AMMONIA AND APPARATUS THEREFOR,,Chemistry,therefor ammonia absorbing apparatus
1926.0,enzymatische spaltung von dipeptiden ii,https://doi.org/10.1515/bchm2.1926.157.1-3.122,Chemistry,dipeptiden enzymatische spaltung von ii
1924.0,untersuchungen uber die konstitution des colchicins,https://doi.org/10.1002/jlac.19244390106,Chemistry,colchicins untersuchungen konstitution die uber des
1925.0,uber ein in chloroform unlosliches glykosid aus digitalis blattern das gitoxin,https://doi.org/10.1002/cber.19250580818,Chemistry,gitoxin blattern digitalis glykosid unlosliches chloroform aus das ein uber
1922.0,uber den mechanismus der oxydationsvorgange,https://doi.org/10.1007/BF02322468,Chemistry,oxydationsvorgange mechanismus den uber der
1924.0,the ultra centrifuge a new instrument for the determination of size and distribution of size of particle in amicroscopic colloids,https://doi.org/10.1021/ja01677a011,Chemistry,size colloids amicroscopic centrifuge ultra instrument determination particle distribution new
1923.0,determination of size and distribution of size of particle by centrifugal methods,https://doi.org/10.1021/ja01665a016,Chemistry,size centrifugal determination particle methods distribution
1902.0,uber sichtbarmachung und grosenbestimmung ultramikoskopischer teilchen mit besonderer anwendung auf goldrubinglaser,https://doi.org/10.1002/andp.19023150102,Chemistry,goldrubinglaser besonderer teilchen grosenbestimmung ultramikoskopischer sichtbarmachung anwendung auf mit und
1905.0,method of determination of carbon and hydrogen in organic compounds,,Chemistry,carbon organic determination compounds hydrogen method
1919.0,the possibility of separating isotopes.,,Chemistry,isotopes separating possibility
1914.0,cxxxii the atomic weight of lead from ceylon thorite,https://doi.org/10.1039/CT9140501402,Chemistry,cxxxii thorite ceylon weight lead atomic
1911.0,der energieinhalt fester stoffe,https://doi.org/10.1002/andp.19113411207,Chemistry,stoffe fester energieinhalt der
1911.0,spezifische warme und quantentheorie,https://doi.org/10.1002/bbpc.19110171809,Chemistry,quantentheorie warme spezifische und
1913.0,uber die technische darstellung von ammoniak aus den elementen,https://doi.org/10.1002/bbpc.19130190201,Chemistry,elementen ammoniak technische darstellung den aus von die uber
1913.0,untersuchungen uber die anthocyane i uber den farbstoff der kornblume,https://doi.org/10.1002/jlac.19134010205,Chemistry,uber kornblume anthocyane farbstoff untersuchungen den die der
1913.0,zur kenntnis der hydrolyse von cellulose i,https://doi.org/10.1002/cber.191304602174,Chemistry,hydrolyse kenntnis cellulose zur von der
1905.0,a revision of the atomic weights of sodium and chlorine 1,https://doi.org/10.1021/ja01983a001,Chemistry,revision chlorine weights atomic sodium
1900.0,regarding some new organometallic combinations of magnesium and their application to alcohol synthesis and hydrocarbides.,,Chemistry,hydrocarbides organometallic regarding alcohol combinations magnesium application synthesis new
1902.0,lxxxiv the radioactivity of thorium compounds ii the cause and nature of radioactivity,https://doi.org/10.1039/CT9028100837,Chemistry,radioactivity thorium lxxxiv cause nature compounds ii
1993.0,isolation and characterization of autophagy defective mutants of saccharomyces cerevisiae,https://doi.org/10.1016/0014-5793(93)80398-E,Medicine,autophagy defective characterization cerevisiae saccharomyces mutants isolation
1977.0,A new sesquiterpene lactone-qinghaosu,,Medicine,qinghaosu lactone sesquiterpene new
1979.0,avermectins new family of potent anthelmintic agents producing organism and fermentation,https://doi.org/10.1128/AAC.15.3.361,Medicine,anthelmintic avermectins agents fermentation organism family potent producing new
1979.0,avermectins new family of potent anthelmintic agents efficacy of the b1a component,https://doi.org/10.1128/AAC.15.3.372,Medicine,b1a efficacy agents anthelmintic avermectins potent family component new
1971.0,the hippocampus as a spatial map preliminary evidence from unit activity in the freely moving rat,https://doi.org/10.1016/0006-8993(71)90358-1,Medicine,hippocampus freely moving preliminary spatial map rat unit evidence activity
1998.0,snarepins minimal machinery for membrane fusion,https://doi.org/10.1016/S0092-8674(00)81404-X,Medicine,minimal snarepins machinery fusion membrane
1962.0,adult frogs derived from the nuclei of single somatic cells,https://doi.org/10.1016/0012-1606(62)90043-X,Medicine,frogs somatic adult nuclei derived single cells
1962.0,the developmental capacity of nuclei taken from intestinal epithelium cells of feeding tadpoles,,Medicine,tadpoles epithelium intestinal feeding capacity taken developmental nuclei cells
1996.0,the dorsoventral regulatory gene cassette spatzle toll cactus controls the potent antifungal response in drosophila adults,https://doi.org/10.1016/S0092-8674(00)80172-5,Medicine,cactus spatzle toll cassette antifungal dorsoventral adults controls drosophila potent
1996.0,the dorsoventral regulatory gene cassette controls the potent antifungal response in drosophila adults,,Medicine,cassette antifungal dorsoventral adults controls drosophila potent regulatory response gene
1978.0,birth after the reimplantation of a human embryo,https://doi.org/10.1016/S0140-6736(78)92957-4,Medicine,reimplantation birth embryo human
1982.0,cloning yeast telomeres on linear plasmid vectors,https://doi.org/10.1016/0092-8674(82)90109-X,Medicine,plasmid vectors telomeres cloning linear yeast
1982.0,cloning yeast telomeres on linear plasmid vectors,https://doi.org/10.1016/0092-8674(82)90109-X,Medicine,plasmid vectors telomeres cloning linear yeast
1984.0,a new type of papillomavirus dna its presence in genital cancer biopsies and in cell lines derived from cervical cancer,,Medicine,cancer cervical biopsies genital papillomavirus lines derived presence dna type
1980.0,high efficiency transformation by direct microinjection of dna into cultured mammalian cells,https://doi.org/10.1016/0092-8674(80)90358-X,Medicine,microinjection cultured efficiency direct transformation mammalian dna cells
1984.0,a comprehensive set of sequence analysis programs for the vax,https://doi.org/10.1093/nar/12.1Part1.387,Medicine,vax programs comprehensive set sequence analysis
1984.0,unidentified curved bacilli in the stomach of patients with gastritis and peptic ulceration,https://doi.org/10.1016/S0140-6736(84)91816-6,Medicine,ulceration peptic gastritis bacilli unidentified curved stomach patients
1984.0,unidentified curved bacilli in the stomach of patients with gastritis and peptic ulceration,https://doi.org/10.1016/S0140-6736(84)91816-6,Medicine,ulceration peptic gastritis bacilli unidentified curved stomach patients
1991.0,a novel multigene family may encode odorant receptors a molecular basis for odor recognition,https://doi.org/10.1016/0092-8674(91)90418-X,Medicine,odor encode odorant multigene recognition basis family receptors novel molecular
1991.0,a novel multigene family may encode odorant receptors a molecular basis for odor recognition,https://doi.org/10.1016/0092-8674(91)90418-X,Medicine,odor encode odorant multigene recognition basis family receptors novel molecular
1974.0,the genetics of caenorhabditis elegans,,Medicine,genetics elegans caenorhabditis
1970.0,neuronal correlates of habituation and dishabituation of the gill withdrawal reflex in aplysia,https://doi.org/10.1126/science.167.3926.1743,Medicine,aplysia withdrawal gill dishabituation correlates habituation reflex neuronal
1977.0,stimulation of guanylate cyclase by sodium nitroprusside nitroglycerin and nitric oxide in various tissue preparations and comparison to the effects of sodium azide and hydroxylamine,,Medicine,sodium nitroglycerin guanylate nitroprusside azide nitric hydroxylamine preparations stimulation oxide
1986.0,phosphodiesterase inhibitors induce endothelium dependent relaxation of rat and rabbit aorta by potentiating the effects of spontaneously released endothelium derived relaxing factor,,Medicine,endothelium potentiating inhibitors relaxing spontaneously phosphodiesterase induce aorta relaxation released
1986.0,depression of contractile responses in rat aorta by spontaneously released endothelium derived relaxing factor,,Medicine,contractile depression responses relaxing spontaneously endothelium aorta released rat factor
1987.0,endothelium derived relaxing factor from pulmonary artery and vein possesses pharmacologic and chemical properties identical to those of nitric oxide radical,https://doi.org/10.1161/01.RES.61.6.866,Medicine,radical pharmacologic vein artery pulmonary nitric relaxing endothelium possesses oxide
1969.0,adenyl cyclase in fat cells ii hormone receptors,,Medicine,fat hormone adenyl receptors cyclase ii cells
1971.0,the glucagon sensitive adenyl cyclase system in plasma membranes of rat liver iv effects of guanyl nucleotides on binding of 125i glucagon,,Medicine,glucagon guanyl 125i iv nucleotides membranes adenyl plasma rat cyclase
1971.0,the glucagon sensitive adenyl cyclase system in plasma membranes of rat liver i properties,,Medicine,glucagon membranes adenyl plasma rat cyclase sensitive liver properties system
1971.0,the glucagon sensitive adenyl cyclase system in plasma membranes of rat liver v an obligatory role of guanyl nucleotides in glucagon action,,Medicine,glucagon obligatory guanyl membranes nucleotides adenyl plasma rat cyclase sensitive
1971.0,the glucagon sensitive adenyl cyclase system in plasma membranes of rat liver iii binding of glucagon method of assay and specificity,,Medicine,glucagon assay membranes adenyl iii rat plasma cyclase specificity sensitive
1969.0,adenyl cyclase in fat cells i properties and the effects of adrenocorticotropin and fluoride,,Medicine,adrenocorticotropin fat fluoride adenyl cyclase effects properties cells
1955.0,Conversion of phosphorylase b to phosphorylase a in muscle extracts.,,Medicine,phosphorylase extracts conversion muscle
1958.0,the reaction of sodium borohydride with muscle phosphorylase1,https://doi.org/10.1021/ja01544a082,Medicine,phosphorylase1 borohydride muscle sodium reaction
1981.0,mproved patch-clamp techniques for high-resolution current recording from cells and cell-free membrane patches,https://doi.org/10.1007/BF00656997,Medicine,mproved patches patch clamp techniques recording current resolution free membrane
1981.0,Improved patch-clamp techniques for high-resolution current recording from cells and cell-free membrane patches,https://doi.org/10.1007/BF00656997,Medicine,patches clamp patch techniques improved recording current resolution free membrane
1959.0,SUPRALETHAL WHOLE BODY IRRADIATION AND ISOLOGOUS MARROW TRANSPLANTATION IN MAN,https://doi.org/10.1172/JCI103949,Medicine,isologous marrow supralethal whole irradiation transplantation man body
1956.0,Successful Homotransplantation of the Kidney in an Identical Twin,,Medicine,homotransplantation twin kidney successful identical
1962.0,pharmacology of a new adrenergic beta receptor blocking compound nethalide,https://doi.org/10.1016/S0140-6736(62)90103-4,Medicine,nethalide blocking pharmacology compound adrenergic receptor beta new
1952.0,studies on condensed pyrimidine systems ix the synthesis of some 6 substituted purines,https://doi.org/10.1021/ja01122a037,Medicine,purines substituted pyrimidine condensed ix systems studies synthesis
1954.0,antagonists of nucleic acid derivatives viii synergism in combinations of biochemically related antimetabolites,,Medicine,antimetabolites biochemically antagonists synergism combinations nucleic viii derivatives related acid
1952.0,studies on condensed pyrimidine systems ix the synthesis of some 6 substituted purines,https://doi.org/10.1021/ja01122a037,Medicine,purines substituted pyrimidine condensed ix systems studies synthesis
1954.0,antagonists of nucleic acid derivatives viii synergism in combinations of biochemically related antimetabolites,,Medicine,antimetabolites biochemically antagonists synergism combinations nucleic viii derivatives related acid
1954.0,a nerve growth stimulating factor isolated from sarcom as 37 and 180,https://doi.org/10.1073/pnas.40.10.1014,Medicine,sarcom 180 37 stimulating growth factor nerve isolated
1956.0,a nerve growth stimulating factor isolated from snake venom,https://doi.org/10.1073/pnas.42.9.571,Medicine,venom snake stimulating growth factor nerve isolated
1952.0,effects of mouse tumor transplantation on the nervous system,https://doi.org/10.1111/j.1749-6632.1952.tb26548.x,Medicine,nervous transplantation tumor mouse effects system
1974.0,binding and degradation of low density lipoproteins by cultured human fibroblasts comparison of cells from a normal subject and from a patient with homozygous familial hypercholesterolemia,,Medicine,hypercholesterolemia familial homozygous lipoproteins degradation cultured patient subject comparison fibroblasts
1974.0,binding and degradation of low density lipoproteins by cultured human fibroblasts comparison of cells from a normal subject and from a patient with homozygous familial hypercholesterolemia,,Medicine,hypercholesterolemia familial homozygous lipoproteins degradation cultured patient subject comparison fibroblasts
1974.0,towards a network theory of the immune system,,Medicine,network towards immune system
1951.0,chromosome organization and genic expression,https://doi.org/10.1101/SQB.1951.016.01.004,Medicine,genic organization chromosome expression
1941.0,the stability of broken ends of chromosomes in zea mays,,Medicine,mays zea chromosomes ends broken stability
1951.0,mutable loci in maize,,Medicine,maize mutable loci
1974.0,prostaglandin endoperoxides vii novel transformations of arachidonic acid in guinea pig lung,https://doi.org/10.1016/0006-291X(74)90246-0,Medicine,vii transformations endoperoxides arachidonic prostaglandin lung guinea pig novel acid
1962.0,receptive fields binocular interaction and functional architecture in the cat s visual cortex,https://doi.org/10.1113/jphysiol.1962.sp006837,Medicine,binocular architecture functional receptive visual cat cortex interaction fields
1963.0,single cell responses in striate cortex of kittens deprived of vision in one eye,https://doi.org/10.1152/jn.1963.26.6.1003,Medicine,vision responses eye kittens deprived striate cortex single cell
1965.0,receptive fields and functional architecture in two nonstriate visual areas 18 and 19 of the cat,https://doi.org/10.1152/jn.1965.28.2.229,Medicine,nonstriate areas architecture 18 19 functional receptive visual cat fields
1963.0,chemoaffinity in the orderly growth of nerve fiber patterns and connections,https://doi.org/10.1073/pnas.50.4.703,Medicine,orderly chemoaffinity connections fiber patterns growth nerve
1962.0,receptive fields binocular interaction and functional architecture in the cat s visual cortex,https://doi.org/10.1113/jphysiol.1962.sp006837,Medicine,binocular architecture functional receptive visual cat cortex interaction fields
1963.0,single cell responses in striate cortex of kittens deprived of vision in one eye,https://doi.org/10.1152/jn.1963.26.6.1003,Medicine,vision responses eye kittens deprived striate cortex single cell
1965.0,receptive fields and functional architecture in two nonstriate visual areas 18 and 19 of the cat,https://doi.org/10.1152/jn.1965.28.2.229,Medicine,nonstriate areas architecture 18 19 functional receptive visual cat fields
1952.0,some transamination reactions involving vitamin b6,,Medicine,b6 transamination vitamin involving reactions
1959.0,the serology and the prognosis of 128 cases of autoimmune hemolytic anemia,,Medicine,autoimmune prognosis 128 serology hemolytic anemia cases
1959.0,acquired hemolytic anemia with polyagglutinability of red blood cells due to a new factor present in normal human serum anti tn,,Medicine,tn polyagglutinability hemolytic acquired anti anemia red serum blood due
1954.0,leukoagglutinins v leukoagglutinins in chronic idiopathic or symptomatic pancytopenia and in paroxysmal nocturnal hemoglobinuria,,Medicine,leukoagglutinins hemoglobinuria paroxysmal nocturnal pancytopenia symptomatic idiopathic chronic
1963.0,studies on the specificity of the cellular infiltrate in delayed hypersensitivity reactions,,Medicine,hypersensitivity infiltrate delayed cellular specificity studies reactions
1961.0,the role of the reticuloendothelial system in the host reaction to neoplasia,,Medicine,neoplasia reticuloendothelial host role reaction system
1963.0,representation of a function by its line integrals with some radiological applications,https://doi.org/10.1063/1.1713127,Medicine,radiological integrals representation line applications function
